query	_id	_score	entrezgene	name	summary	symbol
ARHGEF26	26084	93.85176	26084.0	Rho guanine nucleotide exchange factor 26	This gene encodes a member of the Rho-guanine nucleotide exchange factor (Rho-GEF) family. These proteins regulate Rho GTPases by catalyzing the exchange of GDP for GTP. The encoded protein specifically activates RhoG and plays a role in the promotion of macropinocytosis. Underexpression of the encoded protein may be a predictive marker of chemoresistant disease. Alternatively spliced transcript variants encoding multiple isoforms have been observed for this gene.	ARHGEF26
RYR3	6263	93.48293	6263.0	ryanodine receptor 3	The protein encoded by this gene is a ryanodine receptor, which functions to release calcium from intracellular storage for use in many cellular processes. For example, the encoded protein is involved in skeletal muscle contraction by releasing calcium from the sarcoplasmic reticulum followed by depolarization of T-tubules. Two transcript variants encoding different isoforms have been found for this gene.	RYR3
SCN7A	6332	104.399956	6332.0	sodium voltage-gated channel alpha subunit 7	This gene encodes one of the many voltage-gated sodium channel proteins. For proper functioning of neurons and muscles during action potentials, voltage-gated sodium channels direct sodium ion diffusion for membrane depolarization. This sodium channel protein has some atypical characteristics; the similarity between the human and mouse proteins is lower compared to other orthologous sodium channel pairs. Also, the S4 segments, which sense voltage changes, have fewer positive charged residues that in other sodium channels; domain 4 has fewer arginine and lysine residues compared to other sodium channel proteins. Several alternatively spliced transcript variants exist, but the full-length natures of all of them remain unknown.	SCN7A
ADAM33	80332	95.63159	80332.0	ADAM metallopeptidase domain 33	This gene encodes a member of the ADAM (a disintegrin and metalloprotease domain) family. Members of this family are membrane-anchored proteins structurally related to snake venom disintegrins, and have been implicated in a variety of biological processes involving cell-cell and cell-matrix interactions, including fertilization, muscle development, and neurogenesis. This protein is a type I transmembrane protein implicated in asthma and bronchial hyperresponsiveness. Alternative splicing results in multiple transcript variants encoding different isoforms.	ADAM33
CBX7	23492	94.46579	23492.0	chromobox 7	This gene encodes a protein that contains the CHROMO (CHRomatin Organization MOdifier) domain. The encoded protein is a component of the Polycomb repressive complex 1 (PRC1), and is thought to control the lifespan of several normal human cells.	CBX7
NCAM1	4684	94.25669	4684.0	neural cell adhesion molecule 1	This gene encodes a cell adhesion protein which is a member of the immunoglobulin superfamily. The encoded protein is involved in cell-to-cell interactions as well as cell-matrix interactions during development and differentiation. The encoded protein has been shown to be involved in development of the nervous system, and for cells involved in the expansion of T cells and dendritic cells which play an important role in immune surveillance. Alternative splicing results in multiple transcript variants.	NCAM1
CNR1	1268	92.75952	1268.0	cannabinoid receptor 1	This gene encodes one of two cannabinoid receptors. The cannabinoids, principally delta-9-tetrahydrocannabinol and synthetic analogs, are psychoactive ingredients of marijuana. The cannabinoid receptors are members of the guanine-nucleotide-binding protein (G-protein) coupled receptor family, which inhibit adenylate cyclase activity in a dose-dependent, stereoselective and pertussis toxin-sensitive manner. The two receptors have been found to be involved in the cannabinoid-induced CNS effects (including alterations in mood and cognition) experienced by users of marijuana. Multiple transcript variants encoding two different protein isoforms have been described for this gene.	CNR1
FHL1	2273	95.88508	2273.0	four and a half LIM domains 1	This gene encodes a member of the four-and-a-half-LIM-only protein family. Family members contain two highly conserved, tandemly arranged, zinc finger domains with four highly conserved cysteines binding a zinc atom in each zinc finger. Expression of these family members occurs in a cell- and tissue-specific mode and these proteins are involved in many cellular processes. Mutations in this gene have been found in patients with Emery-Dreifuss muscular dystrophy. Multiple alternately spliced transcript variants which encode different protein isoforms have been described.	FHL1
PRIMA1	145270	92.5905	145270.0	proline rich membrane anchor 1	The product of this gene functions to organize acetylcholinesterase (AChE) into tetramers, and to anchor AChE at neural cell membranes.	PRIMA1
PNISR	25957	92.57302	25957.0	PNN interacting serine and arginine rich protein		PNISR
BEND5	79656	96.147835	79656.0	BEN domain containing 5		BEND5
LONRF2	164832	92.73643	164832.0	LON peptidase N-terminal domain and ring finger 2		LONRF2
ACACB	32	95.40171	32.0	acetyl-CoA carboxylase beta	Acetyl-CoA carboxylase (ACC) is a complex multifunctional enzyme system. ACC is a biotin-containing enzyme which catalyzes the carboxylation of acetyl-CoA to malonyl-CoA, the rate-limiting step in fatty acid synthesis.  ACC-beta is thought to control fatty acid oxidation by means of the ability of malonyl-CoA to inhibit carnitine-palmitoyl-CoA transferase I, the rate-limiting step in fatty acid uptake and oxidation by mitochondria.  ACC-beta may be involved in the regulation of fatty acid oxidation, rather than fatty acid biosynthesis.  There is evidence for the presence of two ACC-beta isoforms.	ACACB
RBPMS2	348093	94.472725	348093.0	RNA binding protein with multiple splicing 2	The protein encoded by this gene is a member of the RNA recognition motif (RRM)-containing protein family and is involved in the development and dedifferentiation of digestive smooth muscle cells. The encoded protein functions as a homodimer and indirectly inhibits the bone morphogenetic protein pathway.	RBPMS2
TCEAL2	140597	103.67943	140597.0	transcription elongation factor A like 2	This gene encodes a member of the transcription elongation factor A (SII)-like (TCEAL) gene family. Members of this family contain TFA domains and may function as nuclear phosphoproteins that modulate transcription in a promoter context-dependent manner. Multiple family members are located on the X chromosome.	TCEAL2
PLCD4	84812	96.419785	84812.0	phospholipase C delta 4	This gene encodes a member of the delta class of phospholipase C enzymes. Phospholipase C enzymes play a critical role in many cellular processes by hydrolyzing phosphatidylinositol 4,5-bisphosphate into two intracellular second messengers, inositol 1,4,5-trisphosphate and diacylglycerol. Expression of this gene may be a marker for cancer.	PLCD4
KCNB1	3745	95.64907	3745.0	potassium voltage-gated channel subfamily B member 1	Voltage-gated potassium (Kv) channels represent the most complex class of voltage-gated ion channels from both functional and structural standpoints. Their diverse functions include regulating neurotransmitter release, heart rate, insulin secretion, neuronal excitability, epithelial electrolyte transport, smooth muscle contraction, and cell volume. Four sequence-related potassium channel genes - shaker, shaw, shab, and shal - have been identified in Drosophila, and each has been shown to have human homolog(s). This gene encodes a member of the potassium channel, voltage-gated, shab-related subfamily. This member is a delayed rectifier potassium channel and its activity is modulated by some other family members.	KCNB1
LIMS2	55679	96.147835	55679.0	LIM zinc finger domain containing 2	This gene encodes a member of a small family of focal adhesion proteins which interacts with ILK (integrin-linked kinase), a protein which effects protein-protein interactions with the extraceullar matrix. The encoded protein has five LIM domains, each domain forming two zinc fingers, which permit interactions which regulate cell shape and migration. A pseudogene of this gene is located on chromosome 4. Multiple transcript variants encoding different isoforms have been found for this gene.	LIMS2
PKD1	5310	94.70917	5310.0	polycystin 1, transient receptor potential channel interacting	This gene encodes a member of the polycystin protein family. The encoded glycoprotein contains a large N-terminal extracellular region, multiple transmembrane domains and a cytoplasmic C-tail. It is an integral membrane protein that functions as a regulator of calcium permeable cation channels and intracellular calcium homoeostasis. It is also involved in cell-cell/matrix interactions and may modulate G-protein-coupled signal-transduction pathways. It plays a role in renal tubular development, and mutations in this gene cause autosomal dominant polycystic kidney disease type 1 (ADPKD1). ADPKD1 is characterized by the growth of fluid-filled cysts that replace normal renal tissue and result in end-stage renal failure. Splice variants encoding different isoforms have been noted for this gene. Also, six pseudogenes, closely linked in a known duplicated region on chromosome 16p, have been described.	PKD1
PRRT1	80863	97.944916	80863.0	proline rich transmembrane protein 1		PRRT1
GRIK5	2901	92.42447	2901.0	glutamate ionotropic receptor kainate type subunit 5	This gene encodes a protein that belongs to the glutamate-gated ionic channel family. Glutamate functions as the major excitatory neurotransmitter in the central nervous system through activation of ligand-gated ion channels and G protein-coupled membrane receptors. The protein encoded by this gene forms functional heteromeric kainate-preferring ionic channels with the subunits encoded by related gene family members. Alternative splicing results in multiple transcript variants.	GRIK5
TUB	7275	94.933174	7275.0	tubby bipartite transcription factor	This gene encodes a member of the Tubby family of bipartite transcription factors. The encoded protein may play a role in obesity and sensorineural degradation. The crystal structure has been determined for a similar protein in mouse, and it functions as a membrane-bound transcription regulator that translocates to the nucleus in response to phosphoinositide hydrolysis. Two transcript variants encoding distinct isoforms have been identified for this gene.	TUB
LMOD1	25802	95.405426	25802.0	leiomodin 1	The leiomodin 1 protein has a putative membrane-spanning region and 2 types of tandemly repeated blocks.  The transcript is expressed in all tissues tested, with the highest levels in thyroid, eye muscle, skeletal muscle, and ovary. Increased expression of leiomodin 1 may be linked to Graves' disease and thyroid-associated ophthalmopathy.	LMOD1
GLP2R	9340	96.16593	9340.0	glucagon like peptide 2 receptor	This gene encodes a G protein-coupled receptor that is closely related to the glucagon receptor and binds to glucagon-like peptide-2 (GLP2). Signalling through GLP2 stimulates intestinal growth and increases villus height in the small intestine, concomitant with increased crypt cell proliferation and decreased enterocyte apoptosis.	GLP2R
ABCA9	10350	98.28649	10350.0	ATP binding cassette subfamily A member 9	This gene is a member of the superfamily of ATP-binding cassette (ABC) transporters and the encoded protein contains two transmembrane domains and two nucleotide binding folds. ABC proteins transport various molecules across extra- and intracellular membranes. ABC genes are divided into seven distinct subfamilies (ABC1, MDR/TAP, MRP, ALD, OABP, GCN20, and White). This gene is a member of the ABC1 subfamily and is clustered with four other ABC1 family members on chromosome 17q24. Transcriptional expression of this gene is induced during monocyte differentiation into macrophages and is suppressed by cholesterol import.	ABCA9
DTX3	196403	96.14476	196403.0	deltex E3 ubiquitin ligase 3	DTX3 functions as an E3 ubiquitin ligase (Takeyama et al., 2003 [PubMed 12670957]).	DTX3
CDH19	28513	94.91508	28513.0	cadherin 19	This gene is one of three related type II cadherin genes situated in a cluster on chromosome 18. The encoded protein is a calcium dependent cell-cell adhesion glycoprotein containing five extracellular cadherin repeats. Loss of cadherins may be associated with cancer formation. Alternative splicing results in multiple transcript variants for this gene.	CDH19
CMYA5	202333	91.76997	202333.0	cardiomyopathy associated 5		CMYA5
CPEB1	64506	95.901886	64506.0	cytoplasmic polyadenylation element binding protein 1	This gene encodes a member of the cytoplasmic polyadenylation element binding protein family. This highly conserved protein binds to a specific RNA sequence, called the cytoplasmic polyadenylation element, found in the 3' untranslated region of some mRNAs. The encoded protein functions in both the cytoplasm and the nucleus. It is involved in the regulation of mRNA translation, as well as processing of the 3' untranslated region, and may play a role in cell proliferation and tumorigenesis. Alternative splicing results in multiple transcript variants.	CPEB1
LGI4	163175	102.38475	163175.0	leucine rich repeat LGI family member 4		LGI4
HAND2	9464	94.91277	9464.0	heart and neural crest derivatives expressed 2	The protein encoded by this gene belongs to the basic helix-loop-helix family of transcription factors. This gene product is one of two closely related family members, the HAND proteins, which are asymmetrically expressed in the developing ventricular chambers and play an essential role in cardiac morphogenesis. Working in a complementary fashion, they function in the formation of the right ventricle and aortic arch arteries, implicating them as mediators of congenital heart disease. In addition, this transcription factor plays an important role in limb and branchial arch development.	HAND2
ADCYAP1R1	117	95.647766	117.0	ADCYAP receptor type I	This gene encodes type I adenylate cyclase activating polypeptide receptor, which is a membrane-associated protein and shares significant homology with members of the glucagon/secretin receptor family. This receptor mediates diverse biological actions of adenylate cyclase activating polypeptide 1 and is positively coupled to adenylate cyclase. Multiple alternatively spliced transcript variants encoding distinct isoforms have been identified.	ADCYAP1R1
CORO6	84940	97.01221	84940.0	coronin 6		CORO6
CAND2	23066	95.6279	23066.0	cullin associated and neddylation dissociated 2 (putative)		CAND2
HECTD2	143279	94.071815	143279.0	HECT domain E3 ubiquitin protein ligase 2		HECTD2
CLIP4	79745	95.38185	79745.0	CAP-Gly domain containing linker protein family member 4		CLIP4
KLHDC1	122773	92.076454	122773.0	kelch domain containing 1		KLHDC1
DPP6	1804	98.28248	1804.0	dipeptidyl peptidase like 6	This gene encodes a single-pass type II membrane protein that is a member of the peptidase S9B family of serine proteases. This protein has no detectable protease activity, most likely due to the absence of the conserved serine residue normally present in the catalytic domain of serine proteases. However, it does bind specific voltage-gated potassium channels and alters their expression and biophysical properties. Variations in this gene may be associated with susceptibility to amyotrophic lateral sclerosis and with idiopathic ventricular fibrillation. Alternative splicing results in multiple transcript variants.	DPP6
DIRC3	ENSG00000231672	116.89057		disrupted in renal carcinoma 3		DIRC3
EBF4	57593	99.046196	57593.0	early B-cell factor 4	EBF4 belongs to the conserved Olf/EBF family of helix-loop-helix transcription factors, members of which play important roles in neural development and B-cell maturation (Wang et al., 2002 [PubMed 12139918]).	EBF4
SSBP2	23635	96.99105	23635.0	single stranded DNA binding protein 2	This gene encodes a subunit of a protein complex that interacts with single-stranded DNA and is involved in the DNA damage response and maintenance of genome stability. The encoded protein may also play a role in telomere repair. A variant of this gene may be associated with survival in human glioblastoma patients.	SSBP2
MTFR1L	56181	92.91383	56181.0	mitochondrial fission regulator 1 like		MTFR1L
PLA2G2C	391013	98.28248	391013.0	phospholipase A2 group IIC		PLA2G2C
C1QTNF4	114900	99.04794	114900.0	C1q and tumor necrosis factor related protein 4		C1QTNF4
DCAF5	8816	94.91569	8816.0	DDB1 and CUL4 associated factor 5		DCAF5
NACAD	23148	96.43789	23148.0	NAC alpha domain containing		NACAD
