query	_id	_score	entrezgene	name	summary	symbol
FGF10	2255	96.419785	2255.0	fibroblast growth factor 10	The protein encoded by this gene is a member of the fibroblast growth factor (FGF) family. FGF family members possess broad mitogenic and cell survival activities, and are involved in a variety of biological processes, including embryonic development, cell growth, morphogenesis, tissue repair, tumor growth and invasion. This protein exhibits mitogenic activity for keratinizing epidermal cells, but essentially no activity for fibroblasts, which is similar to the biological activity of FGF7. Studies of the mouse homolog of suggested that this gene is required for embryonic epidermal morphogenesis including brain development, lung morphogenesis, and initiation of lim bud formation. This gene is also implicated to be a primary factor in the process of wound healing.	FGF10
LAMA2	3908	93.849464	3908.0	laminin subunit alpha 2	Laminin, an extracellular protein, is a major component of the basement membrane. It is thought to mediate the attachment, migration, and organization of cells into tissues during embryonic development by interacting with other extracellular matrix components. It is composed of three subunits, alpha, beta, and gamma, which are bound to each other by disulfide bonds into a cross-shaped molecule. This gene encodes the alpha 2 chain, which constitutes one of the subunits of laminin 2 (merosin) and laminin 4 (s-merosin). Mutations in this gene have been identified as the cause of congenital merosin-deficient muscular dystrophy. Two transcript variants encoding different proteins have been found for this gene.	LAMA2
TCEAL4	79921	103.003136	79921.0	transcription elongation factor A like 4	This gene encodes a member of the transcription elongation factor A (SII)-like (TCEAL) gene family. This family is comprised of nuclear phosphoproteins that modulate transcription in a promoter context-dependent manner. Multiple family members are located on the X chromosome. Alternatively splicing results in multiple transcript variants. There is a pseudogene for this gene on chromosome 13.	TCEAL4
SYNE1	23345	94.70852	23345.0	spectrin repeat containing nuclear envelope protein 1	This gene encodes a spectrin repeat containing protein expressed in skeletal and smooth muscle, and peripheral blood lymphocytes, that localizes to the nuclear membrane. Mutations in this gene have been associated with autosomal recessive spinocerebellar ataxia 8, also referred to as autosomal recessive cerebellar ataxia type 1 or recessive ataxia of Beauce. Alternatively spliced transcript variants encoding different isoforms have been described.	SYNE1
EZH1	2145	95.64907	2145.0	enhancer of zeste 1 polycomb repressive complex 2 subunit	EZH1 is a component of a noncanonical Polycomb repressive complex-2 (PRC2) that mediates methylation of histone H3 (see MIM 602812) lys27 (H3K27) and functions in the maintenance of embryonic stem cell pluripotency and plasticity (Shen et al., 2008 [PubMed 19026780]).	EZH1
GSTM5	2949	111.521095	2949.0	glutathione S-transferase mu 5	Cytosolic and membrane-bound forms of glutathione S-transferase are encoded by two distinct supergene families. At present, eight distinct classes of the soluble cytoplasmic mammalian glutathione S-transferases have been identified: alpha, kappa, mu, omega, pi, sigma, theta and zeta. This gene encodes a glutathione S-transferase that belongs to the mu class. The mu class of enzymes functions in the detoxification of electrophilic compounds, including carcinogens, therapeutic drugs, environmental toxins and products of oxidative stress, by conjugation with glutathione. The genes encoding the mu class of enzymes are organized in a gene cluster on chromosome 1p13.3 and are known to be highly polymorphic. These genetic variations can change an individual's susceptibility to carcinogens and toxins as well as affect the toxicity and efficacy of certain drugs. Diversification of these genes has occurred in regions encoding substrate-binding domains, as well as in tissue expression patterns, to accommodate an increasing number of foreign compounds.	GSTM5
PRRT2	112476	99.027435	112476.0	proline rich transmembrane protein 2	This gene encodes a transmembrane protein containing a proline-rich domain in its N-terminal half. Studies in mice suggest that it is predominantly expressed in brain and spinal cord in embryonic and postnatal stages. Mutations in this gene are associated with episodic kinesigenic dyskinesia-1. Alternatively spliced transcript variants encoding different isoforms have been found for this gene.	PRRT2
ABCA6	23460	97.941986	23460.0	ATP binding cassette subfamily A member 6	The membrane-associated protein encoded by this gene is a member of the superfamily of ATP-binding cassette (ABC) transporters. ABC proteins transport various molecules across extra- and intracellular membranes. ABC genes are divided into seven distinct subfamilies (ABC1, MDR/TAP, MRP, ALD, OABP, GCN20, and White). This encoded protein is a member of the ABC1 subfamily. Members of the ABC1 subfamily comprise the only major ABC subfamily found exclusively in multicellular eukaryotes. This gene is clustered among 4 other ABC1 family members on 17q24 and may play a role in macrophage lipid homeostasis.	ABCA6
STAT5B	6777	102.980034	6777.0	signal transducer and activator of transcription 5B	The protein encoded by this gene is a member of the STAT family of transcription factors. In response to cytokines and growth factors, STAT family members are phosphorylated by the receptor associated kinases, and then form homo- or heterodimers that translocate to the cell nucleus where they act as transcription activators. This protein mediates the signal transduction triggered by various cell ligands, such as IL2, IL4, CSF1, and different growth hormones. It has been shown to be involved in diverse biological processes, such as TCR signaling, apoptosis, adult mammary gland development, and sexual dimorphism of liver gene expression. This gene was found to fuse to retinoic acid receptor-alpha (RARA) gene in a small subset of acute promyelocytic leukemias (APLL). The dysregulation of the signaling pathways mediated by this protein may be the cause of the APLL.	STAT5B
CHRD	8646	95.40366	8646.0	chordin	This gene encodes a secreted protein that dorsalizes early vertebrate embryonic tissues by binding to ventralizing TGF-beta-like bone morphogenetic proteins and sequestering them in latent complexes. The encoded protein may also have roles in organogenesis and during adulthood. It has been suggested that this gene could be a candidate gene for Cornelia de Lange syndrome. Reduced expression of this gene results in enhanced bone regeneration. Alternative splicing results in multiple transcript variants. Other alternative splice variants have been described but their full length sequence has not been determined.	CHRD
TUBGCP6	85378	92.58919	85378.0	tubulin gamma complex associated protein 6	The protein encoded by this gene is part of a large multisubunit complex required for microtubule nucleation at the centrosome.	TUBGCP6
PEG3	5178	100.283905	5178.0	paternally expressed 3	In human, ZIM2 and PEG3 are treated as two distinct genes though they share multiple 5' exons and a common promoter and both genes are paternally expressed (PMID:15203203). Alternative splicing events connect their shared 5' exons either with the remaining 4 exons unique to ZIM2, or with the remaining 2 exons unique to PEG3. In contrast, in other mammals ZIM2 does not undergo imprinting and, in mouse, cow, and likely other mammals as well, the ZIM2 and PEG3 genes do not share exons. Human PEG3 protein belongs to the Kruppel C2H2-type zinc finger protein family. PEG3 may play a role in cell proliferation and p53-mediated apoptosis. PEG3 has also shown tumor suppressor activity and tumorigenesis in glioma and ovarian cells. Alternative splicing of this PEG3 gene results in multiple transcript variants encoding distinct isoforms.	PEG3
CMYA5	202333	91.76997	202333.0	cardiomyopathy associated 5		CMYA5
ZMAT1	84460	100.756805	84460.0	zinc finger matrin-type 1	This gene encodes a protein containing Cys2-His2 (C2H2)-type zinc fingers, which are similar to those found in the nuclear matrix protein matrin 3. Alternatively spliced transcript variants have been found for this gene.	ZMAT1
SEC31B	25956	95.3786	25956.0	SEC31 homolog B, COPII coat complex component	This gene encodes a protein of unknown function. The protein has moderate similarity to rat VAP1 protein which is an endosomal membrane-associated protein, containing a putative Ca2+/calmodulin-dependent kinase II phosphorylation site.	SEC31B
GOLGA6L4	643707	113.72381	643707.0	golgin A6 family-like 4		GOLGA6L4
GPRASP2	114928	105.21313	114928.0	G protein-coupled receptor associated sorting protein 2	The protein encoded by this gene is a member of a family that regulates the activity of G protein-coupled receptors (GPCRs). The encoded protein has been shown to be capable of interacting with several GPCRs, including the M1 muscarinic acetylcholine receptor and the calcitonin receptor. Several transcript variants encoding the same protein have been found for this gene.	GPRASP2
PEAR1	375033	99.046196	375033.0	platelet endothelial aggregation receptor 1	PEAR1 is a platelet receptor that signals upon the formation of platelet-platelet contacts independent of platelet activation and secondary to platelet aggregation (Nanda et al., 2005 [PubMed 15851471]).	PEAR1
MUM1L1	139221	101.80978	139221.0	MUM1 like 1	This gene encodes a protein which contains a mutated melanoma-associated antigen 1 domain. Proteins which contain mutated antigens are expressed at high levels on certain types of cancers. Multiple alternatively spliced variants, encoding the same protein, have been identified.	MUM1L1
ABCA9	10350	98.28649	10350.0	ATP binding cassette subfamily A member 9	This gene is a member of the superfamily of ATP-binding cassette (ABC) transporters and the encoded protein contains two transmembrane domains and two nucleotide binding folds. ABC proteins transport various molecules across extra- and intracellular membranes. ABC genes are divided into seven distinct subfamilies (ABC1, MDR/TAP, MRP, ALD, OABP, GCN20, and White). This gene is a member of the ABC1 subfamily and is clustered with four other ABC1 family members on chromosome 17q24. Transcriptional expression of this gene is induced during monocyte differentiation into macrophages and is suppressed by cholesterol import.	ABCA9
FBXO31	79791	92.42447	79791.0	F-box protein 31	This gene is a member of the F-box family. Members are classified into three classes according to the substrate interaction domain, FBW for WD40 repeats, FBL for leucing-rich repeats, and FBXO for other domains. This protein, classified into the last category because of the lack of a recognizable substrate binding domain, has been proposed to be a component of the SCF ubiquitination complex. It is thought to bind and recruit substrate for ubiquitination and degradation. This protein may have a role in regulating the cell cycle as well as dendrite growth and neuronal migration. Alternative splicing results in multiple transcript variants.	FBXO31
STARD9	57519	92.91415	57519.0	StAR related lipid transfer domain containing 9		STARD9
RUFY3	22902	93.09231	22902.0	RUN and FYVE domain containing 3	This gene encodes a RPIP8, UNC-14, and NESCA domain-containing protein that is required for maintenance of neuronal polarity. In addition, it has been implicated in mediation of gastric cancer cell migration and invasion via interaction with P21-activated kinase-1, which promotes its expression. The encoded protein localizes to F-actin-enriched invadopodia to induce formation of protrusions, thereby facilitating cell migration. Alternative splicing results in multiple transcript variants.	RUFY3
PBX3	5090	93.84902	5090.0	PBX homeobox 3		PBX3
WFIKKN2	124857	96.43789	124857.0	WAP, follistatin/kazal, immunoglobulin, kunitz and netrin domain containing 2	The WFIKKN1 protein contains a WAP domain, follistatin domain, immunoglobulin domain, two tandem Kunitz domains, and an NTR domain. This gene encodes a WFIKKN1-related protein which has the same domain organization as the WFIKKN1 protein. The WAP-type, follistatin type, Kunitz-type, and NTR-type protease inhibitory domains may control the action of multiple types of proteases.	WFIKKN2
ARX	170302	93.869865	170302.0	aristaless related homeobox	This gene is a homeobox-containing gene expressed during development. The expressed protein contains two conserved domains, a C-peptide (or aristaless domain) and the prd-like class homeobox domain. It is a member of the group-II aristaless-related protein family whose members are expressed primarily in the central and/or peripheral nervous system. This gene is thought to be involved in CNS development. Expansion of a polyalanine tract and other mutations in this gene cause X-linked mental retardation and epilepsy.	ARX
ARMCX4	100131755	102.3597	100131755.0	armadillo repeat containing, X-linked 4	The product of this gene belongs to the armadillo repeat-containing family of proteins, which interact with other proteins in a variety of cellular processes. The function of this family member is currently unknown. Alternative splicing of this gene results in multiple transcript variants.	ARMCX4
AASS	10157	94.27654	10157.0	aminoadipate-semialdehyde synthase	This gene encodes a bifunctional enzyme that catalyzes the first two steps in the mammalian lysine degradation pathway. The N-terminal and the C-terminal portions of this enzyme contain lysine-ketoglutarate reductase and saccharopine dehydrogenase activity, respectively, resulting in the conversion of lysine to alpha-aminoadipic semialdehyde. Mutations in this gene are associated with familial hyperlysinemia.	AASS
NKTR	4820	90.25634	4820.0	natural killer cell triggering receptor	This gene encodes a membrane-anchored protein with a hydrophobic amino terminal domain and a cyclophilin-like PPIase domain. It is present on the surface of natural killer cells and facilitates their binding to targets. Its expression is regulated by IL2 activation of the cells.	NKTR
SECISBP2	79048	92.40342	79048.0	SECIS binding protein 2	The incorporation of selenocysteine into a protein requires the concerted action of an mRNA element called a sec insertion sequence (SECIS), a selenocysteine-specific translation elongation factor and a SECIS binding protein. With these elements in place, a UGA codon can be decoded as selenocysteine. The gene described in this record encodes a nuclear protein that functions as a SECIS binding protein. Mutations in this gene have been associated with a reduction in activity of a specific thyroxine deiodinase, a selenocysteine-containing enzyme, and abnormal thyroid hormone metabolism. Alternate splicing results in multiple transcript variants.	SECISBP2
SLC1A7	6512	96.69856	6512.0	solute carrier family 1 member 7		SLC1A7
CTB-50L17.14	ENSG00000267385	116.889275				CTB-50L17.14
STXBP5L	9515	93.87053	9515.0	syntaxin binding protein 5 like	The protein encoded by this gene is similar to syntaxin-binding protein 5 and contains ten N-terminal WD40 repeats, four variable region WD40 repeats, and a C-terminal R-SNARE domain. Studies of the orthologous proteins in mouse and rat have shown that the encoded protein may inhibit exocytosis in neurosecretory cells, and may negatively regulate the secretion of insulin. A missense variant in this gene is likely the cause of an infantile-onset neurodegenerative disorder diagnosed in two siblings of consanguineous parents.	STXBP5L
