query	_id	_score	entrezgene	name	summary	symbol
IFFO1	25900	95.647766	25900.0	intermediate filament family orphan 1	This gene is a member of the intermediate filament family. Intermediate filaments are proteins which are primordial components of the cytoskeleton and nuclear envelope. The proteins encoded by the members of this gene family are evolutionarily and structurally related but have limited sequence homology, with the exception of the central rod domain. Multiple alternatively spliced transcript variants encoding different isoforms have been found for this gene.	IFFO1
SYTL4	94121	96.69533	94121.0	synaptotagmin like 4	This gene encodes a member of the synaptotagmin like protein family. Members of this family are characterized by an N-terminal Rab27 binding domain and C-terminal tandem C2 domains. The encoded protein binds specific small Rab GTPases and is involved in intracellular membrane trafficking. This protein binds Rab27 and may be involved in inhibiting dense core vesicle exocytosis. Alternate splicing results in multiple transcript variants that encode the same protein.	SYTL4
ZDHHC17	23390	94.06987	23390.0	zinc finger DHHC-type containing 17		ZDHHC17
ZNF540	163255	106.128685	163255.0	zinc finger protein 540		ZNF540
PLIN5	440503	99.027435	440503.0	perilipin 5	Members of the perilipin family, such as PLIN5, coat intracellular lipid storage droplets and protect them from lipolytic degradation (Dalen et al., 2007 [PubMed 17234449]).	PLIN5
CACNA1H	8912	95.40171	8912.0	calcium voltage-gated channel subunit alpha1 H	This gene encodes a T-type member of the alpha-1 subunit family, a protein in the voltage-dependent calcium channel complex. Calcium channels mediate the influx of calcium ions into the cell upon membrane polarization and consist of a complex of alpha-1, alpha-2/delta, beta, and gamma subunits in a 1:1:1:1 ratio. The alpha-1 subunit has 24 transmembrane segments and forms the pore through which ions pass into the cell. There are multiple isoforms of each of the proteins in the complex, either encoded by different genes or the result of alternative splicing of transcripts. Alternate transcriptional splice variants, encoding different isoforms, have been characterized for the gene described here. Studies suggest certain mutations in this gene lead to childhood absence epilepsy (CAE).	CACNA1H
MAP3K5	4217	94.93382	4217.0	mitogen-activated protein kinase kinase kinase 5	Mitogen-activated protein kinase (MAPK) signaling cascades include MAPK or extracellular signal-regulated kinase (ERK), MAPK kinase (MKK or MEK), and MAPK kinase kinase (MAPKKK or MEKK). MAPKK kinase/MEKK phosphorylates and activates its downstream protein kinase, MAPK kinase/MEK, which in turn activates MAPK. The kinases of these signaling cascades are highly conserved, and homologs exist in yeast, Drosophila, and mammalian cells. MAPKKK5 contains 1,374 amino acids with all 11 kinase subdomains. Northern blot analysis shows that MAPKKK5 transcript is abundantly expressed in human heart and pancreas. The MAPKKK5 protein phosphorylates and activates MKK4 (aliases SERK1, MAPKK4) in vitro, and activates c-Jun N-terminal kinase (JNK)/stress-activated protein kinase (SAPK) during transient expression in COS and 293 cells; MAPKKK5 does not activate MAPK/ERK.	MAP3K5
POU6F1	5463	94.933174	5463.0	POU class 6 homeobox 1		POU6F1
JAKMIP3	282973	94.25669	282973.0	Janus kinase and microtubule interacting protein 3		JAKMIP3
RNASE4	6038	105.2165	6038.0	ribonuclease A family member 4	The protein encoded by this gene belongs to the pancreatic ribonuclease family. It plays an important role in mRNA cleavage and has marked specificity towards the 3' side of uridine nucleotides. Alternative splicing results in four transcript variants encoding the same protein. This gene and the gene that encodes angiogenin share promoters and 5' exons. Each gene splices to a unique downstream exon that contains its complete coding region.	RNASE4
SPAG9	9043	96.43658	9043.0	sperm associated antigen 9	This gene encodes a member of the cancer testis antigen gene family. The encoded protein functions as a scaffold protein that structurally organizes mitogen-activated protein kinases and mediates c-Jun-terminal kinase signaling. This protein also binds to kinesin-1 and may be involved in microtubule-based membrane transport. This protein may play a role in tumor growth and development. Alternate splicing results in multiple transcript variants.	SPAG9
MON2	23041	94.05	23041.0	MON2 homolog, regulator of endosome-to-Golgi trafficking		MON2
GOLGA8S	ENSG00000261739	116.89057		golgin A8 family member S		GOLGA8S
GOLGA8R	101059918	116.86941	101059918.0	golgin A8 family member R		GOLGA8R
GOLGA8M	653720	116.889275	653720.0	golgin A8 family member M		GOLGA8M
ANGPTL5	253935	95.88572	253935.0	angiopoietin like 5		ANGPTL5
GOLGA8N	643699	116.87248	643699.0	golgin A8 family member N		GOLGA8N
ARHGAP10	79658	96.16833	79658.0	Rho GTPase activating protein 10		ARHGAP10
PID1	55022	92.73966	55022.0	phosphotyrosine interaction domain containing 1		PID1
MYO15B	ENSG00000266714	102.98403		myosin XVB		MYO15B
ASIP	434	96.698875	434.0	agouti signaling protein	In mice, the agouti gene encodes a paracrine signaling molecule that causes hair follicle melanocytes to synthesize pheomelanin, a yellow pigment, instead of the black or brown pigment, eumelanin. Pleiotropic effects of constitutive expression of the mouse gene include adult-onset obesity, increased tumor susceptibility, and premature infertility. This gene is highly similar to the mouse gene and encodes a secreted protein that may (1) affect the quality of hair pigmentation, (2) act as a pharmacological antagonist of alpha-melanocyte-stimulating hormone, (3) play a role in neuroendocrine aspects of melanocortin action, and (4) have a functional role in regulating lipid metabolism in adipocytes.	ASIP
GOLGA8A	23015	116.8731	23015.0	golgin A8 family member A	The Golgi apparatus, which participates in glycosylation and transport of proteins and lipids in the secretory pathway, consists of a series of stacked, flattened membrane sacs referred to as cisternae. Interactions between the Golgi and microtubules are thought to be important for the reorganization of the Golgi after it fragments during mitosis. The golgins constitute a family of proteins which are localized to the Golgi. This gene encodes a golgin which structurally resembles its family member GOLGA2, suggesting that they may share a similar function. There are many similar copies of this gene on chromosome 15. Alternative splicing results in multiple transcript variants.	GOLGA8A
GOLGA8B	440270	113.74692	440270.0	golgin A8 family member B		GOLGA8B
STAR	6770	92.076454	6770.0	steroidogenic acute regulatory protein	The protein encoded by this gene plays a key role in the acute regulation of steroid hormone synthesis by enhancing the conversion of cholesterol into pregnenolone. This protein permits the cleavage of cholesterol into pregnenolone by mediating the transport of cholesterol from the outer mitochondrial membrane to the inner mitochondrial membrane. Mutations in this gene are a cause of congenital lipoid adrenal hyperplasia (CLAH), also called lipoid CAH. A pseudogene of this gene is located on chromosome 13.	STAR
LRRN4CL	221091	100.28421	221091.0	LRRN4 C-terminal like		LRRN4CL
ABCA8	10351	105.23398	10351.0	ATP binding cassette subfamily A member 8	The membrane-associated protein encoded by this gene is a member of the superfamily of ATP-binding cassette (ABC) transporters. ABC proteins transport various molecules across extra- and intracellular membranes. ABC genes are divided into seven distinct subfamilies (ABC1, MDR/TAP, MRP, ALD, OABP, GCN20, White). This protein is a member of the ABC1 subfamily. Members of the ABC1 subfamily comprise the only major ABC subfamily found exclusively in multicellular eukaryotes. The encoded protein may regulate lipid metabolism and be involved in the formation and maintenance of myelin. Alternative splicing results in multiple transcript variants.	ABCA8
GABBR1	2550	95.3786	2550.0	gamma-aminobutyric acid type B receptor subunit 1	This gene encodes a receptor for gamma-aminobutyric acid (GABA), which is the main inhibitory neurotransmitter in the mammalian central nervous system. This receptor functions as a heterodimer with GABA(B) receptor 2. Defects in this gene may underlie brain disorders such as schizophrenia and epilepsy. Alternative splicing generates multiple transcript variants, but the full-length nature of some of these variants has not been determined.	GABBR1
TDRD10	126668	99.04424	126668.0	tudor domain containing 10		TDRD10
ACADL	33	95.40171	33.0	acyl-CoA dehydrogenase, long chain	The protein encoded by this gene belongs to the acyl-CoA dehydrogenase family, which is a family of mitochondrial flavoenzymes involved in fatty acid and branched chain amino-acid metabolism. This protein is one of the four enzymes that catalyze the initial step of mitochondrial beta-oxidation of straight-chain fatty acid. Defects in this gene are the cause of long-chain acyl-CoA dehydrogenase (LCAD) deficiency, leading to nonketotic hypoglycemia.	ACADL
GPRASP1	9737	101.79167	9737.0	G protein-coupled receptor associated sorting protein 1	This gene encodes a member of the GPRASP (G protein-coupled receptor associated sorting protein) family. The protein may modulate lysosomal sorting and functional down-regulation of a variety of G-protein coupled receptors. It targets receptors for degradation in lysosomes. The receptors interacting with this sorting protein include D2 dopamine receptor (DRD2), delta opioid receptor (OPRD1), beta-2 adrenergic receptor (ADRB2), D4 dopamine receptor (DRD4) and cannabinoid 1 receptor (CB1R). Multiple alternatively spliced transcript variants encoding the same protein have been identified.	GPRASP1
SRSF5	6430	95.88278	6430.0	serine and arginine rich splicing factor 5	The protein encoded by this gene is a member of the serine/arginine (SR)-rich family of pre-mRNA splicing factors, which constitute part of the spliceosome. Each of these factors contains an RNA recognition motif (RRM) for binding RNA and an RS domain for binding other proteins. The RS domain is rich in serine and arginine residues and facilitates interaction between different SR splicing factors. In addition to being critical for mRNA splicing, the SR proteins have also been shown to be involved in mRNA export from the nucleus and in translation. Alternative splicing results in multiple transcript variants.	SRSF5
WISP2	8839	92.239815	8839.0	WNT1 inducible signaling pathway protein 2	This gene encodes a member of the WNT1 inducible signaling pathway (WISP) protein subfamily, which belongs to the connective tissue growth factor (CTGF) family. WNT1 is a member of a family of cysteine-rich, glycosylated signaling proteins that mediate diverse developmental processes. The CTGF family members are characterized by four conserved cysteine-rich domains: insulin-like growth factor-binding domain, von Willebrand factor type C module, thrombospondin domain and C-terminal cystine knot-like (CT) domain. The encoded protein lacks the CT domain which is implicated in dimerization and heparin binding. It is 72% identical to the mouse protein at the amino acid level. This gene may be downstream in the WNT1 signaling pathway that is relevant to malignant transformation. Its expression in colon tumors is reduced while the other two WISP members are overexpressed in colon tumors. It is expressed at high levels in bone tissue, and may play an important role in modulating bone turnover.	WISP2
USP47	55031	94.935585	55031.0	ubiquitin specific peptidase 47		USP47
NEK9	91754	92.935646	91754.0	NIMA related kinase 9	This gene encodes a member of the NimA (never in mitosis A) family of serine/threonine protein kinases. The encoded protein is activated in mitosis and, in turn, activates other family members during mitosis. This protein also mediates cellular processes that are essential for interphase progression.	NEK9
ADRB3	155	96.41671	155.0	adrenoceptor beta 3	The protein encoded by this gene belongs to the family of beta adrenergic receptors, which mediate catecholamine-induced activation of adenylate cyclase through the action of G proteins. This receptor is located mainly in the adipose tissue and is involved in the regulation of lipolysis and thermogenesis.	ADRB3
MPDZ	8777	95.164536	8777.0	multiple PDZ domain crumbs cell polarity complex component	The protein encoded by this gene has multiple PDZ domains, which are hallmarks of protein-protein interactions. The encoded protein is known to interact with the HTR2C receptor and may cause it to clump at the cell surface. Multiple transcript variants encoding different isoforms have been found for this gene.	MPDZ
TBC1D2B	23102	93.86855	23102.0	TBC1 domain family member 2B		TBC1D2B
TSPYL2	64061	104.399956	64061.0	TSPY like 2	This gene encodes a member of the testis-specific protein Y-encoded, TSPY-like/SET/nucleosome assembly protein-1 superfamily. The encoded protein is localized to the nucleolus where it functions in chromatin remodeling and as an inhibitor of cell-cycle progression. This protein may play a role in the suppression of tumor growth.	TSPYL2
JAM3	83700	97.31488	83700.0	junctional adhesion molecule 3	Tight junctions represent one mode of cell-to-cell adhesion in epithelial or endothelial cell sheets, forming continuous seals around cells and serving as a physical barrier to prevent solutes and water from passing freely through the paracellular space. The protein encoded by this immunoglobulin superfamily gene member is localized in the tight junctions between high endothelial cells. Unlike other proteins in this family, the this protein is unable to adhere to leukocyte cell lines and only forms weak homotypic interactions. The encoded protein is a member of the junctional adhesion molecule protein family and acts as a receptor for another member of this family. A mutation in an intron of this gene is associated with hemorrhagic destruction of the brain, subependymal calcification, and congenital cataracts. Alternative splicing results in multiple transcript variants.	JAM3
TSHZ3	57616	94.93187	57616.0	teashirt zinc finger homeobox 3	This gene encodes a zinc-finger transcription factor that regulates smooth muscle cell differentiation in the developing urinary tract. Consistent with this role, mice in which this gene has been inactivated exhibit abnormal gene expression in urinary tract smooth muscle cell precursors and kidney defects including hydronephrosis. The encoded transcription factor comprises a gene silencing complex that inhibits caspase expression. Reduced expression of this gene and consequent caspase upregulation may be correlated with progression of Alzheimer's disease in human patients.	TSHZ3
DST	667	95.165184	667.0	dystonin	This gene encodes a member of the plakin protein family of adhesion junction plaque proteins. Multiple alternatively spliced transcript variants encoding distinct isoforms have been found for this gene, but the full-length nature of some variants has not been defined. It has been reported that some isoforms are expressed in neural and muscle tissue, anchoring neural intermediate filaments to the actin cytoskeleton, and some isoforms are expressed in epithelial tissue, anchoring keratin-containing intermediate filaments to hemidesmosomes. Consistent with the expression, mice defective for this gene show skin blistering and neurodegeneration.	DST
GCKR	2646	95.630974	2646.0	glucokinase regulator	This gene encodes a protein belonging to the GCKR subfamily of the SIS (Sugar ISomerase) family of proteins. The gene product is a regulatory protein that inhibits glucokinase in liver and pancreatic islet cells by binding non-covalently to form an inactive complex with the enzyme. This gene is considered a susceptibility gene candidate for a form of maturity-onset diabetes of the young (MODY).	GCKR
KIAA0895L	653319	95.88235	653319.0	KIAA0895 like		KIAA0895L
ZNF25	219749	103.68119	219749.0	zinc finger protein 25		ZNF25
ITPR1	3708	93.48293	3708.0	inositol 1,4,5-trisphosphate receptor type 1	This gene encodes an intracellular receptor for inositol 1,4,5-trisphosphate. Upon stimulation by inositol 1,4,5-trisphosphate, this receptor mediates calcium release from the endoplasmic reticulum. Mutations in this gene cause spinocerebellar ataxia type 15, a disease associated with an heterogeneous group of cerebellar disorders. Multiple transcript variants have been identified for this gene.	ITPR1
FGF2	2247	95.382614	2247.0	fibroblast growth factor 2	The protein encoded by this gene is a member of the fibroblast growth factor (FGF) family. FGF family members bind heparin and possess broad mitogenic and angiogenic activities. This protein has been implicated in diverse biological processes, such as limb and nervous system development, wound healing, and tumor growth. The mRNA for this gene contains multiple polyadenylation sites, and is alternatively translated from non-AUG (CUG) and AUG initiation codons, resulting in five different isoforms with distinct properties. The CUG-initiated isoforms are localized in the nucleus and are responsible for the intracrine effect, whereas, the AUG-initiated form is mostly cytosolic and is responsible for the paracrine and autocrine effects of this FGF.	FGF2
ANKRD29	147463	96.994125	147463.0	ankyrin repeat domain 29		ANKRD29
ZEB2	9839	94.71092	9839.0	zinc finger E-box binding homeobox 2	The protein encoded by this gene is a member of the Zfh1 family of 2-handed zinc finger/homeodomain proteins. It is located in the nucleus and functions as a DNA-binding transcriptional repressor that interacts with activated SMADs. Mutations in this gene are associated with Hirschsprung disease/Mowat-Wilson syndrome. Alternatively spliced transcript variants have been found for this gene.	ZEB2
ABCA10	10349	103.657616	10349.0	ATP binding cassette subfamily A member 10	The membrane-associated protein encoded by this gene is a member of the superfamily of ATP-binding cassette (ABC) transporters. ABC proteins transport various molecules across extra- and intracellular membranes. ABC genes are divided into seven distinct subfamilies (ABC1, MDR/TAP, MRP, ALD, OABP, GCN20, and White). This encoded protein is a member of the ABC1 subfamily. Members of the ABC1 subfamily comprise the only major ABC subfamily found exclusively in multicellular eukaryotes. This gene is clustered among 4 other ABC1 family members on 17q24, but neither the substrate nor the function of this gene is known.	ABCA10
PROK1	84432	94.071815	84432.0	prokineticin 1	The protein encoded by this gene induces proliferation, migration, and fenestration (the formation of membrane discontinuities) in capillary endothelial cells derived from endocrine glands. It has little or no effect on a variety of other endothelial and non-endothelial cell types. Its expression is restricted to the steroidogenic glands (ovary, testis, adrenal, and placenta), is induced by hypoxia, and often complementary to the expression of vascular endothelial growth factor (VEGF), suggesting that these molecules function in a coordinated manner.	PROK1
PRDM5	11107	91.640976	11107.0	PR/SET domain 5	The protein encoded by this gene is a transcription factor of the PR-domain protein family. It contains a PR-domain and multiple zinc finger motifs. Transcription factors of the PR-domain family are known to be involved in cell differentiation and tumorigenesis.	PRDM5
FOXL2NB	401089	105.21587	401089.0	FOXL2 neighbor		FOXL2NB
CPED1	79974	93.27743	79974.0	cadherin like and PC-esterase domain containing 1		CPED1
HLF	3131	96.43658	3131.0	HLF, PAR bZIP transcription factor	This gene encodes a member of the proline and acidic-rich (PAR) protein family, a subset of the bZIP transcription factors. The encoded protein forms homodimers or heterodimers with other PAR family members and binds sequence-specific promoter elements to activate transcription. Chromosomal translocations fusing portions of this gene with the E2A gene cause a subset of childhood B-lineage acute lymphoid leukemias. Alternatively spliced transcript variants have been described, but their biological validity has not been determined.	HLF
CNRIP1	25927	95.164536	25927.0	cannabinoid receptor interacting protein 1	This gene encodes a protein that interacts with the C-terminal tail of cannabinoid receptor 1. Two transcript variants encoding different isoforms have been described for this gene.	CNRIP1
SCN7A	6332	104.399956	6332.0	sodium voltage-gated channel alpha subunit 7	This gene encodes one of the many voltage-gated sodium channel proteins. For proper functioning of neurons and muscles during action potentials, voltage-gated sodium channels direct sodium ion diffusion for membrane depolarization. This sodium channel protein has some atypical characteristics; the similarity between the human and mouse proteins is lower compared to other orthologous sodium channel pairs. Also, the S4 segments, which sense voltage changes, have fewer positive charged residues that in other sodium channels; domain 4 has fewer arginine and lysine residues compared to other sodium channel proteins. Several alternatively spliced transcript variants exist, but the full-length natures of all of them remain unknown.	SCN7A
PDGFRA	5156	96.70164	5156.0	platelet derived growth factor receptor alpha	This gene encodes a cell surface tyrosine kinase receptor for members of the platelet-derived growth factor family. These growth factors are mitogens for cells of mesenchymal origin. The identity of the growth factor bound to a receptor monomer determines whether the functional receptor is a homodimer or a heterodimer, composed of both platelet-derived growth factor receptor alpha and beta polypeptides. Studies suggest that this gene plays a role in organ development, wound healing, and tumor progression. Mutations in this gene have been associated with idiopathic hypereosinophilic syndrome, somatic and familial gastrointestinal stromal tumors, and a variety of other cancers.	PDGFRA
CIRBP	1153	96.699326	1153.0	cold inducible RNA binding protein		CIRBP
NPHP3	27031	93.849464	27031.0	nephrocystin 3	This gene encodes a protein containing a coiled-coil (CC) domain, a tubulin-tyrosine ligase (TTL) domain, and a tetratrico peptide repeat (TPR) domain. The encoded protein interacts with nephrocystin, it is required for normal ciliary development, and it functions in renal tubular development. Mutations in this gene are associated with nephronophthisis type 3, and also with renal-hepatic-pancreatic dysplasia, and Meckel syndrome type 7. Naturally occurring read-through transcripts exist between this gene and the downstream ACAD11 (acyl-CoA dehydrogenase family, member 11) gene.	NPHP3
TRPC1	7220	94.49261	7220.0	transient receptor potential cation channel subfamily C member 1	The protein encoded by this gene is a membrane protein that can form a non-selective channel permeable to calcium and other cations. The encoded protein appears to be induced to form channels by a receptor tyrosine kinase-activated phosphatidylinositol second messenger system and also by depletion of intracellular calcium stores. Two transcript variants encoding different isoforms have been found for this gene.	TRPC1
CBX7	23492	94.46579	23492.0	chromobox 7	This gene encodes a protein that contains the CHROMO (CHRomatin Organization MOdifier) domain. The encoded protein is a component of the Polycomb repressive complex 1 (PRC1), and is thought to control the lifespan of several normal human cells.	CBX7
CSDC2	27254	94.90877	27254.0	cold shock domain containing C2		CSDC2
PODN	127435	93.11317	127435.0	podocan	The protein encoded by this gene is a member of the small leucine-rich repeat protein family and contains an amino terminal CX3CXCX7C cysteine-rich cluster followed by a leucine-rich repeat domain. Studies suggest that this protein could function to inhibit smooth muscle cell proliferation and migration following arterial injury.	PODN
CACNB2	783	94.687675	783.0	calcium voltage-gated channel auxiliary subunit beta 2	This gene encodes a subunit of a voltage-dependent calcium channel protein that is a member of the voltage-gated calcium channel superfamily. The gene product was originally identified as an antigen target in Lambert-Eaton myasthenic syndrome, an autoimmune disorder. Mutations in this gene are associated with Brugada syndrome. Alternatively spliced variants encoding different isoforms have been described.	CACNB2
KIAA1109	84162	94.469345	84162.0	KIAA1109	This gene is located on the long arm of chromosome 4 in a region that is associated with susceptibility to celiac disease. The encoded protein is similar to a Chinese hamster protein that is associated with spermatocyte and adipocyte differentiation. The C-terminus of the protein is also similar to a Caenorhabditis elegans protein that plays a role in lipid storage. In mammals, this protein is thought to function in the regulation of epithelial growth and differentiation, and in tumor development.	KIAA1109
TMEM150C	441027	94.70917	441027.0	transmembrane protein 150C		TMEM150C
PLA2G5	5322	101.2576	5322.0	phospholipase A2 group V	This gene is a member of the secretory phospholipase A2 family. It is located in a tightly-linked cluster of secretory phospholipase A2 genes on chromosome 1. The encoded enzyme catalyzes the hydrolysis of membrane phospholipids to generate lysophospholipids and free fatty acids including arachidonic acid. It preferentially hydrolyzes linoleoyl-containing phosphatidylcholine substrates. Secretion of this enzyme is thought to induce inflammatory responses in neighboring cells. Alternatively spliced transcript variants have been found, but their full-length nature has not been determined.	PLA2G5
