query	_id	_score	entrezgene	name	notfound	summary	symbol
FBXO17	115290	101.25391	115290.0	F-box protein 17		This gene encodes a member of the F-box protein family which is characterized by the F-box motif. The F-box proteins constitute one of the four subunits of the ubiquitin protein ligase complex called SCFs (SKP1-cullin-F-box), which function in phosphorylation-dependent ubiquitination. The F-box proteins are divided into 3 classes: Fbws containing WD-40 domains, Fbls containing leucine-rich repeats, and Fbxs containing either different protein-protein interaction modules or no recognizable motifs. The protein encoded by this gene belongs to the Fbxs class and it contains an F-box domain. Alternative splicing results in multiple transcript variants.	FBXO17
CSNK2B-LY6G5B-1181					True		
CAPRIN2	65981	95.14337	65981.0	caprin family member 2		The protein encoded by this gene may regulate the transport of mRNA. It may play a role in the differentiation of erythroblasts. Multiple transcript variants encoding different isoforms have been found for this gene.	CAPRIN2
TNRC6A	27327	94.06987	27327.0	trinucleotide repeat containing 6A		This gene encodes a member of the trinucleotide repeat containing 6 protein family. The protein functions in post-transcriptional gene silencing through the RNA interference (RNAi) and microRNA pathways. The protein associates with messenger RNAs and Argonaute proteins in cytoplasmic bodies known as GW-bodies or P-bodies. Inhibiting expression of this gene delocalizes other GW-body proteins and impairs RNAi and microRNA-induced gene silencing.	TNRC6A
MROH7	374977	97.6332	374977.0	maestro heat like repeat family member 7			MROH7
ENTHD2					True		
RP11-347C12.1					True		
DLG4	1742	97.316826	1742.0	discs large MAGUK scaffold protein 4		This gene encodes a member of the membrane-associated guanylate kinase (MAGUK) family. It heteromultimerizes with another MAGUK protein, DLG2, and is recruited into NMDA receptor and potassium channel clusters. These two MAGUK proteins may interact at postsynaptic sites to form a multimeric scaffold for the clustering of receptors, ion channels, and associated signaling proteins. Multiple transcript variants encoding different isoforms have been found for this gene.	DLG4
ZNF354B	117608	104.397026	117608.0	zinc finger protein 354B			ZNF354B
FAM153A	285596	107.15725	285596.0	family with sequence similarity 153 member A			FAM153A
COL27A1	85301	92.40342	85301.0	collagen type XXVII alpha 1 chain		This gene encodes a member of the fibrillar collagen family, and plays a role during the calcification of cartilage and the transition of cartilage to bone. The encoded protein product is a preproprotein. It includes an N-terminal signal peptide, which is followed by an N-terminal propetide, mature peptide and a C-terminal propeptide. The N-terminal propeptide contains thrombospondin N-terminal-like and laminin G-like domains. The mature peptide is a major triple-helical region. The C-terminal propeptide, also known as COLFI domain, plays crucial roles in tissue growth and repair. Mutations in this gene cause Steel syndrome. Alternatively spliced transcript variants have been found, but the full-length nature of some variants has not been determined.	COL27A1
RNF207	388591	94.071815	388591.0	ring finger protein 207			RNF207
SLC26A10	65012	95.88235	65012.0	solute carrier family 26 member 10			SLC26A10
EP400NL	347918	116.89057	347918.0	EP400 N-terminal like			EP400NL
DMTF1	9988	95.14706	9988.0	cyclin D binding myb like transcription factor 1		This gene encodes a transcription factor that contains a cyclin D-binding domain, three central Myb-like repeats, and two flanking acidic transactivation domains at the N- and C-termini. The encoded protein is induced by the oncogenic Ras signaling pathway and functions as a tumor suppressor by activating the transcription of ARF and thus the ARF-p53 pathway to arrest cell growth or induce apoptosis. It also activates the transcription of aminopeptidase N and may play a role in hematopoietic cell differentiation. The transcriptional activity of this protein is regulated by binding of D-cyclins. This gene is hemizygously deleted in approximately 40% of human non-small-cell lung cancer and is a potential prognostic and gene-therapy target for non-small-cell lung cancer. Multiple transcript variants encoding different isoforms have been found for this gene.	DMTF1
LUC7L3	51747	91.91988	51747.0	LUC7 like 3 pre-mRNA splicing factor		This gene encodes a protein with an N-terminal half that contains cysteine/histidine motifs and leucine zipper-like repeats, and the C-terminal half is rich in arginine and glutamate residues (RE domain) and arginine and serine residues (RS domain). This protein localizes with a speckled pattern in the nucleus, and could be involved in the formation of splicesome via the RE and RS domains. Two alternatively spliced transcript variants encoding the same protein have been found for this gene.	LUC7L3
PRSS53	339105	96.16463	339105.0	protease, serine 53			PRSS53
CCNL2	81669	94.68735	81669.0	cyclin L2		The protein encoded by this gene belongs to the cyclin family. Through its interaction with several proteins, such as RNA polymerase II, splicing factors, and cyclin-dependent kinases, this protein functions as a regulator of the pre-mRNA splicing process, as well as in inducing apoptosis by modulating the expression of apoptotic and antiapoptotic proteins. Alternatively spliced transcript variants encoding different isoforms have been described for this gene.	CCNL2
MAN2C1	4123	92.24256	4123.0	mannosidase alpha class 2C member 1			MAN2C1
RP11-574K11.31					True		
CLCN6	1185	93.48468	1185.0	chloride voltage-gated channel 6		This gene encodes a member of the voltage-dependent chloride channel protein family. Members of this family can function as either chloride channels or antiporters. This protein is primarily localized to late endosomes and functions as a chloride/proton antiporter. Alternate splicing results in both coding and non-coding variants. Additional alternately spliced variants have been described but their full-length structure is unknown.	CLCN6
SGK494	124923	111.49751	124923.0	uncharacterized serine/threonine-protein kinase SgK494			SGK494
CENPT	80152	95.62866	80152.0	centromere protein T		The centromere is a specialized chromatin domain, present throughout the cell cycle, that acts as a platform on which the transient assembly of the kinetochore occurs during mitosis. All active centromeres are characterized by the presence of long arrays of nucleosomes in which CENPA (MIM 117139) replaces histone H3 (see MIM 601128). CENPT is an additional factor required for centromere assembly (Foltz et al., 2006 [PubMed 16622419]).	CENPT
FAM193B	54540	94.91277	54540.0	family with sequence similarity 193 member B			FAM193B
L3MBTL1	26013	94.91232	26013.0	l(3)mbt-like 1 (Drosophila)		This gene represents a polycomb group gene. The encoded protein functions to regulate gene activity, likely via chromatin modification. The encoded protein may also be necessary for mitosis. Alternatively spliced transcript variants encoding different isoforms have been identified.	L3MBTL1
STARD9	57519	92.91415	57519.0	StAR related lipid transfer domain containing 9			STARD9
MYO15B	ENSG00000266714	102.98403		myosin XVB			MYO15B
MYO15A	51168	95.382614	51168.0	myosin XVA		This gene encodes an unconventional myosin. This protein differs from other myosins in that it has a long N-terminal extension preceding the conserved motor domain. Studies in mice suggest that this protein is necessary for actin organization in the hair cells of the cochlea. Mutations in this gene have been associated with profound, congenital, neurosensory, nonsyndromal deafness. This gene is located within the Smith-Magenis syndrome region on chromosome 17. Read-through transcripts containing an upstream gene and this gene have been identified, but they are not thought to encode a fusion protein. Several alternatively spliced transcript variants have been described, but their full length sequences have not been determined.	MYO15A
NUMBL	9253	97.316826	9253.0	NUMB like, endocytic adaptor protein			NUMBL
GOLGA8A	23015	116.8731	23015.0	golgin A8 family member A		The Golgi apparatus, which participates in glycosylation and transport of proteins and lipids in the secretory pathway, consists of a series of stacked, flattened membrane sacs referred to as cisternae. Interactions between the Golgi and microtubules are thought to be important for the reorganization of the Golgi after it fragments during mitosis. The golgins constitute a family of proteins which are localized to the Golgi. This gene encodes a golgin which structurally resembles its family member GOLGA2, suggesting that they may share a similar function. There are many similar copies of this gene on chromosome 15. Alternative splicing results in multiple transcript variants.	GOLGA8A
MSANTD2	79684	95.382614	79684.0	Myb/SANT DNA binding domain containing 2			MSANTD2
GOLGA8B	440270	113.74692	440270.0	golgin A8 family member B			GOLGA8B
NFATC4	4776	97.6332	4776.0	nuclear factor of activated T-cells 4		This gene encodes a member of the nuclear factor of activated T cells (NFAT) protein family. The encoded protein is part of a DNA-binding transcription complex. This complex consists of at least two components: a preexisting cytosolic component that translocates to the nucleus upon T cell receptor stimulation and an inducible nuclear component. NFAT proteins are activated by the calmodulin-dependent phosphatase, calcineurin. The encoded protein plays a role in the inducible expression of cytokine genes in T cells, especially in the induction of interleukin-2 and interleukin-4. Alternative splicing results in multiple transcript variants.	NFATC4
PNISR	25957	92.57302	25957.0	PNN interacting serine and arginine rich protein			PNISR
GABBR1	2550	95.3786	2550.0	gamma-aminobutyric acid type B receptor subunit 1		This gene encodes a receptor for gamma-aminobutyric acid (GABA), which is the main inhibitory neurotransmitter in the mammalian central nervous system. This receptor functions as a heterodimer with GABA(B) receptor 2. Defects in this gene may underlie brain disorders such as schizophrenia and epilepsy. Alternative splicing generates multiple transcript variants, but the full-length nature of some of these variants has not been determined.	GABBR1
NCKAP5L	57701	96.14476	57701.0	NCK associated protein 5 like			NCKAP5L
TSPYL2	64061	104.399956	64061.0	TSPY like 2		This gene encodes a member of the testis-specific protein Y-encoded, TSPY-like/SET/nucleosome assembly protein-1 superfamily. The encoded protein is localized to the nucleolus where it functions in chromatin remodeling and as an inhibitor of cell-cycle progression. This protein may play a role in the suppression of tumor growth.	TSPYL2
SUPT7L	9913	96.69856	9913.0	SPT7-like STAGA complex gamma subunit		SUPT7L is a protein subunit of the human STAGA complex (SPT3; (MIM 602947)/TAF9 (MIM 600822)/GCN5 (MIM 602301) acetyltransferase complex), which is a chromatin-modifying multiprotein complex (Martinez et al., 2001 [PubMed 11564863]).	SUPT7L
AHSA2	130872	94.25669	130872.0	activator of HSP90 ATPase homolog 2			AHSA2
WSB1	26118	93.275116	26118.0	WD repeat and SOCS box containing 1		This gene encodes a member of the WD-protein subfamily. This protein shares a high sequence identity to mouse and chick proteins. It contains several WD-repeats spanning most of the protein and an SOCS box in the C-terminus. Alternatively spliced transcript variants encoding distinct isoforms have been found for this gene.	WSB1
KCNIP2	30819	96.43789	30819.0	potassium voltage-gated channel interacting protein 2		This gene encodes a member of the family of voltage-gated potassium (Kv) channel-interacting proteins (KCNIPs), which belongs to the recoverin branch of the EF-hand superfamily. Members of the KCNIP family are small calcium binding proteins. They all have EF-hand-like domains, and differ from each other in the N-terminus. They are integral subunit components of native Kv4 channel complexes. They may regulate A-type currents, and hence neuronal excitability, in response to changes in intracellular calcium. Multiple alternatively spliced transcript variants encoding distinct isoforms have been identified from this gene.	KCNIP2
TRO	7216	99.02515	7216.0	trophinin		This gene encodes a membrane protein that mediates cell adhesion between trophoblastic cells and the epithelial cells of the endometrium. The encoded protein participates in cell signalling during embryo implantation, and may also be involved in cancer formation. This gene is located near several other closely related genes on chromosome X. Alternative splicing results in multiple transcript variants.	TRO
CDC25B	994	98.64994	994.0	cell division cycle 25B		CDC25B is a member of the CDC25 family of phosphatases. CDC25B activates the cyclin dependent kinase CDC2 by removing two phosphate groups and it is required for entry into mitosis. CDC25B shuttles between the nucleus and the cytoplasm due to nuclear localization and nuclear export signals. The protein is nuclear in the M and G1 phases of the cell cycle and moves to the cytoplasm during S and G2. CDC25B has oncogenic properties, although its role in tumor formation has not been determined. Multiple transcript variants for this gene exist.	CDC25B
PARP6	56965	97.96239	56965.0	poly(ADP-ribose) polymerase family member 6			PARP6
GNRH1	2796	93.11186	2796.0	gonadotropin releasing hormone 1		This gene encodes a preproprotein that is proteolytically processed to generate a peptide that is a member of the gonadotropin-releasing hormone (GnRH) family of peptides. Alternative splicing results in multiple transcript variants, at least one of which is secreted and then cleaved to generate gonadoliberin-1 and GnRH-associated peptide 1. Gonadoliberin-1 stimulates the release of luteinizing and follicle stimulating hormones, which are important for reproduction. Mutations in this gene are associated with hypogonadotropic hypogonadism.	GNRH1
RIMKLB	57494	94.28026	57494.0	ribosomal modification protein rimK like family member B			RIMKLB
ARGLU1	55082	94.91569	55082.0	arginine and glutamate rich 1			ARGLU1
PLAGL1	5325	97.01092	5325.0	PLAG1 like zinc finger 1		This gene encodes a C2H2 zinc finger protein that functions as a suppressor of cell growth. This gene is often deleted or methylated and silenced in cancer cells. In addition, overexpression of this gene during fetal development is thought to be the causal factor for transient neonatal diabetes mellitus (TNDM). Alternative splicing and the use of alternative promoters results in multiple transcript variants encoding two different protein isoforms. The P1 downstream promoter of this gene is imprinted, with preferential expression from the paternal allele in many tissues.	PLAGL1
AMY2B	280	108.35193	280.0	amylase, alpha 2B (pancreatic)		Amylases are secreted proteins that hydrolyze 1,4-alpha-glucoside bonds in oligosaccharides and polysaccharides, and thus catalyze the first step in digestion of dietary starch and glycogen. The human genome has a cluster of several amylase genes that are expressed at high levels in either salivary gland or pancreas. This gene encodes an amylase isoenzyme produced by the pancreas.	AMY2B
GABRE	2564	101.79167	2564.0	gamma-aminobutyric acid type A receptor epsilon subunit		The product of this gene belongs to the ligand-gated ionic channel (TC 1.A.9) family. It encodes the gamma-aminobutyric acid (GABA) A receptor which is a multisubunit chloride channel that mediates the fastest inhibitory synaptic transmission in the central nervous system. This gene encodes an epsilon subunit. It is mapped to chromosome Xq28 in a cluster comprised of genes encoding alpha 3, beta 4 and theta subunits of the same receptor. Alternatively spliced transcript variants have been identified, but only one is thought to encode a protein.	GABRE
GPR173	54328	98.28605	54328.0	G protein-coupled receptor 173		This gene encodes a member of the G-protein coupled receptor 1 family. This protein contains 7 transmembrane domains and conserved cysteine residues.	GPR173
EGFL8	80864	101.25391	80864.0	EGF like domain multiple 8			EGFL8
ZNF333	84449	100.77555	84449.0	zinc finger protein 333			ZNF333
FNBP4	23360	94.707214	23360.0	formin binding protein 4			FNBP4
RP5-966M1.6	ENSG00000243696	116.89123					RP5-966M1.6
MKNK1	8569	93.65617	8569.0	MAP kinase interacting serine/threonine kinase 1		This gene encodes a Ser/Thr protein kinase that interacts with, and is activated by ERK1 and p38 mitogen-activated protein kinases, and thus may play a role in the response to environmental stress and cytokines. This kinase may also regulate transcription by phosphorylating eIF4E via interaction with the C-terminal region of eIF4G. Alternatively spliced transcript variants have been noted for this gene.	MKNK1
ADAMTS10	81794	96.148445	81794.0	ADAM metallopeptidase with thrombospondin type 1 motif 10		This gene belongs to the ADAMTS (a disintegrin and metalloproteinase domain with thrombospondin type-1 motifs) family of zinc-dependent proteases. ADAMTS proteases are complex secreted enzymes containing a prometalloprotease domain of the reprolysin type attached to an ancillary domain with a highly conserved structure that includes at least one thrombospondin type 1 repeat. They have been demonstrated to have important roles in connective tissue organization, coagulation, inflammation, arthritis, angiogenesis and cell migration. The product of this gene plays a major role in growth and in skin, lens, and heart development. It is also a candidate gene for autosomal recessive Weill-Marchesani syndrome.	ADAMTS10
TMEM110-MUSTN1	100526772	116.892975	100526772.0	TMEM110-MUSTN1 readthrough		This locus represents naturally occurring read-through transcription between the neighboring TMEM110 (transmembrane protein 110) and MUSTN1 (musculoskeletal, embryonic nuclear protein 1) genes. The read-through transcript encodes a fusion protein that shares sequence identity with each individual gene product.	TMEM110-MUSTN1
ADAM33	80332	95.63159	80332.0	ADAM metallopeptidase domain 33		This gene encodes a member of the ADAM (a disintegrin and metalloprotease domain) family. Members of this family are membrane-anchored proteins structurally related to snake venom disintegrins, and have been implicated in a variety of biological processes involving cell-cell and cell-matrix interactions, including fertilization, muscle development, and neurogenesis. This protein is a type I transmembrane protein implicated in asthma and bronchial hyperresponsiveness. Alternative splicing results in multiple transcript variants encoding different isoforms.	ADAM33
PAXBP1	94104	92.73999	94104.0	PAX3 and PAX7 binding protein 1		This gene encodes a protein that may bind to GC-rich DNA sequences, which suggests its involvement in the regulation of transcription. Alternative splicing of this gene results in multiple transcript variants.	PAXBP1
FAM160B2	64760	97.014626	64760.0	family with sequence similarity 160 member B2			FAM160B2
MSS51	118490	94.91569	118490.0	MSS51 mitochondrial translational activator			MSS51
CLASRP	11129	94.69105	11129.0	CLK4 associating serine/arginine rich protein			CLASRP
DNHD1	144132	94.71092	144132.0	dynein heavy chain domain 1			DNHD1
VAMP1	6843	95.630974	6843.0	vesicle associated membrane protein 1		Synapotobrevins, syntaxins, and the synaptosomal-associated protein SNAP25 are the main components of a protein complex involved in the docking and/or fusion of synaptic vesicles with the presynaptic membrane. The protein encoded by this gene is a member of the vesicle-associated membrane protein (VAMP)/synaptobrevin family. Mutations in this gene are associated with autosomal dominant spastic ataxia 1. Multiple alternative splice variants have been described, but the full-length nature of some variants has not been defined.	VAMP1
GNB3	2784	95.90318	2784.0	G protein subunit beta 3		Heterotrimeric guanine nucleotide-binding proteins (G proteins), which integrate signals between receptors and effector proteins, are composed of an alpha, a beta, and a gamma subunit. These subunits are encoded by families of related genes. This gene encodes a beta subunit which belongs to the WD repeat G protein beta family. Beta subunits are important regulators of alpha subunits, as well as of certain signal transduction receptors and effectors. A single-nucleotide polymorphism (C825T) in this gene is associated with essential hypertension and obesity. This polymorphism is also associated with the occurrence of the splice variant GNB3-s, which appears to have increased activity. GNB3-s is an example of alternative splicing caused by a nucleotide change outside of the splice donor and acceptor sites. Alternative splicing results in multiple transcript variants. Additional alternatively spliced transcript variants of this gene have been described, but their full-length nature is not known.	GNB3
COL5A3	50509	96.41671	50509.0	collagen type V alpha 3 chain		This gene encodes an alpha chain for one of the low abundance fibrillar collagens. Fibrillar collagen molecules are trimers that can be composed of one or more types of alpha chains. Type V collagen is found in tissues containing type I collagen and appears to regulate the assembly of heterotypic fibers composed of both type I and type V collagen. This gene product is closely related to type XI collagen and it is possible that the collagen chains of types V and XI constitute a single collagen type with tissue-specific chain combinations. Mutations in this gene are thought to be responsible for the symptoms of a subset of patients with Ehlers-Danlos syndrome type III. Messages of several sizes can be detected in northern blots but sequence information cannot confirm the identity of the shorter messages.	COL5A3
GGA3	23163	93.11317	23163.0	golgi associated, gamma adaptin ear containing, ARF binding protein 3		This gene encodes a member of the Golgi-localized, gamma adaptin ear-containing, ARF-binding (GGA) family. This family includes ubiquitous coat proteins that regulate the trafficking of proteins between the trans-Golgi network and the lysosome. These proteins share an amino-terminal VHS domain which mediates sorting of the mannose 6-phosphate receptors at the trans-Golgi network. They also contain a carboxy-terminal region with homology to the ear domain of gamma-adaptins. Multiple alternatively spliced transcript variants have been identified in this gene.	GGA3
AGAP6	414189	116.87248	414189.0	ArfGAP with GTPase domain, ankyrin repeat and PH domain 6			AGAP6
MAPK8IP3	23162	93.09507	23162.0	mitogen-activated protein kinase 8 interacting protein 3		The protein encoded by this gene shares similarity with the product of Drosophila syd gene, required for the functional interaction of kinesin I with axonal cargo. Studies of the similar gene in mouse suggested that this protein may interact with, and regulate the activity of numerous protein kinases of the JNK signaling pathway, and thus function as a scaffold protein in neuronal cells. The C. elegans counterpart of this gene is found to regulate synaptic vesicle transport possibly by integrating JNK signaling and kinesin-1 transport. Several alternatively spliced transcript variants of this gene have been described, but the full-length nature of some of these variants has not been determined.	MAPK8IP3
TAF1C	9013	97.93799	9013.0	TATA-box binding protein associated factor, RNA polymerase I subunit C		Initiation of transcription by RNA polymerase I requires the formation of a complex composed of the TATA-binding protein (TBP) and three TBP-associated factors (TAFs) specific for RNA polymerase I. This complex, known as SL1, binds to the core promoter of ribosomal RNA genes to position the polymerase properly and acts as a channel for regulatory signals. This gene encodes the largest SL1-specific TAF. Multiple alternatively spliced transcript variants encoding different isoforms have been identified.	TAF1C
FAM156A	29057	108.35822	29057.0	family with sequence similarity 156 member A			FAM156A
GSTM2	2946	111.49785	2946.0	glutathione S-transferase mu 2		Cytosolic and membrane-bound forms of glutathione S-transferase are encoded by two distinct supergene families. At present, eight distinct classes of the soluble cytoplasmic mammalian glutathione S-transferases have been identified: alpha, kappa, mu, omega, pi, sigma, theta and zeta. This gene encodes a glutathione S-transferase that belongs to the mu class. The mu class of enzymes functions in the detoxification of electrophilic compounds, including carcinogens, therapeutic drugs, environmental toxins and products of oxidative stress, by conjugation with glutathione. The genes encoding the mu class of enzymes are organized in a gene cluster on chromosome 1p13.3 and are known to be highly polymorphic. These genetic variations can change an individual's susceptibility to carcinogens and toxins as well as affect the toxicity and efficacy of certain drugs.	GSTM2
LY6G5B	58496	95.165184	58496.0	lymphocyte antigen 6 family member G5B		LY6G5B belongs to a cluster of leukocyte antigen-6 (LY6) genes located in the major histocompatibility complex (MHC) class III region on chromosome 6. Members of the LY6 superfamily typically contain 70 to 80 amino acids, including 8 to 10 cysteines. Most LY6 proteins are attached to the cell surface by a glycosylphosphatidylinositol (GPI) anchor that is directly involved in signal transduction (Mallya et al., 2002 [PubMed 12079290]).	LY6G5B
