query	_id	_score	entrezgene	name	notfound	summary	symbol
STX16	8675	94.707214	8675.0	syntaxin 16		This gene encodes a protein that is a member of the syntaxin or t-SNARE (target-SNAP receptor) family. These proteins are found on cell membranes and serve as the targets for V-SNARES (vesicle-SNAP receptors) permitting specific synaptic vesicle docking and fusion. A microdeletion in the region of chromosome 20 where this gene is located has been associated with pseudohypoparathyroidism type Ib. Multiple transcript variants have been found for this gene. Read-through transcription also exists between this gene and the neighboring downstream aminopeptidase-like 1 (NPEPL1) gene.	STX16
LENG8	114823	96.14476	114823.0	leukocyte receptor cluster member 8			LENG8
RBM6	10180	99.42221	10180.0	RNA binding motif protein 6			RBM6
LCAT	3931	94.707214	3931.0	lecithin-cholesterol acyltransferase		This gene encodes the extracellular cholesterol esterifying enzyme, lecithin-cholesterol acyltransferase. The esterification of cholesterol is required for cholesterol transport. Mutations in this gene have been found to cause fish-eye disease as well as LCAT deficiency.	LCAT
BEGAIN	57596	91.32343	57596.0	brain enriched guanylate kinase associated			BEGAIN
SEC31B	25956	95.3786	25956.0	SEC31 homolog B, COPII coat complex component		This gene encodes a protein of unknown function. The protein has moderate similarity to rat VAP1 protein which is an endosomal membrane-associated protein, containing a putative Ca2+/calmodulin-dependent kinase II phosphorylation site.	SEC31B
CORO6	84940	97.01221	84940.0	coronin 6			CORO6
NPIPB5	100132247	116.89123	100132247.0	nuclear pore complex interacting protein family member B5			NPIPB5
FAM229A	100128071	99.86079	100128071.0	family with sequence similarity 229 member A			FAM229A
SIN3B	23309	92.9106	23309.0	SIN3 transcription regulator family member B			SIN3B
PPT2-EGFL8	ENSG00000258388	116.892975		PPT2-EGFL8 readthrough (NMD candidate)			PPT2-EGFL8
KLF8	11279	96.72214	11279.0	Kruppel like factor 8		This gene encodes a protein which is a member of the Sp/KLF family of transcription factors. Members of this family contain a C-terminal DNA-binding domain with three Kruppel-like zinc fingers. The encoded protein is thought to play an important role in the regulation of epithelial to mesenchymal transition, a process which occurs normally during development but also during metastasis. A pseudogene has been identified on chromosome 16. Alternative splicing results in multiple transcript variants.	KLF8
RP11-106M3.2	ENSG00000260729	116.89057					RP11-106M3.2
TTLL3	26140	101.808464	26140.0	tubulin tyrosine ligase like 3			TTLL3
ACAP3	116983	94.25345	116983.0	ArfGAP with coiled-coil, ankyrin repeat and PH domains 3			ACAP3
RTEL1-TNFRSF6B	ENSG00000026036	116.889275		RTEL1-TNFRSF6B readthrough (NMD candidate)			RTEL1-TNFRSF6B
MROH7-TTC4	ENSG00000271723	116.86618		MROH7-TTC4 readthrough (NMD candidate)			MROH7-TTC4
TIAF1	9220	99.844604	9220.0	TGFB1-induced anti-apoptotic factor 1			TIAF1
DDX26B					True		
MAPKBP1	23005	95.90318	23005.0	mitogen-activated protein kinase binding protein 1			MAPKBP1
MAP3K12	7786	93.67235	7786.0	mitogen-activated protein kinase kinase kinase 12		This gene encodes a member of the serine/threonine protein kinase family. This kinase contains a leucine-zipper domain and is predominately expressed in neuronal cells. The phosphorylation state of this kinase in synaptic terminals was shown to be regulated by membrane depolarization via calcineurin. This kinase forms heterodimers with leucine zipper containing transcription factors, such as cAMP responsive element binding protein (CREB) and MYC, and thus may play a regulatory role in PKA or retinoic acid induced neuronal differentiation. Alternatively spliced transcript variants encoding different proteins have been described.	MAP3K12
NKTR	4820	90.25634	4820.0	natural killer cell triggering receptor		This gene encodes a membrane-anchored protein with a hydrophobic amino terminal domain and a cyclophilin-like PPIase domain. It is present on the surface of natural killer cells and facilitates their binding to targets. Its expression is regulated by IL2 activation of the cells.	NKTR
MBD1	4152	95.62866	4152.0	methyl-CpG binding domain protein 1		The protein encoded by this gene is a member of a family of nuclear proteins related by the presence of a methyl-CpG binding domain (MBD). These proteins are capable of binding specifically to methylated DNA, and some members can also repress transcription from methylated gene promoters. This protein contains multiple domains: MBD at the N-terminus that functions both in binding to methylated DNA and in protein interactions; several CXXC-type zinc finger domains that mediate binding to non-methylated CpG dinucleotides; transcriptional repression domain (TRD) at the C-terminus that is involved in transcription repression and in protein interactions. Numerous alternatively spliced transcript variants encoding different isoforms have been noted for this gene.	MBD1
ZNF655	79027	102.38475	79027.0	zinc finger protein 655		This gene encodes a zinc finger protein. The zinc finger proteins are involved in DNA binding and protein-protein interactions. Multiple alternatively spliced transcript variants encoding distinct isoforms have been found for this gene.	ZNF655
SEC61A2	55176	93.46188	55176.0	Sec61 translocon alpha 2 subunit		The protein encoded by this gene has similarity to a mouse protein which suggests a role in the insertion of secretory and membrane polypeptides into the endoplasmic reticulum. It may also be required for the assembly of membrane and secretory proteins. Alternative splicing results in multiple transcript variants.	SEC61A2
UBAP1L	390595	94.49261	390595.0	ubiquitin associated protein 1 like			UBAP1L
